{
  "$schema": "https://json-schema.org/draft/2020-12/schema",
  "$id": "https://sentinelpr.io/schemas/phase4/finding-observation.schema.json",
  "title": "SentinelPR Real Finding Observation Schema",
  "description": "Schema for individual findings recorded during real repository validation, separating detection, ground truth, audited classification, and remediation.",
  "type": "object",
  "required": [
    "observationId",
    "repositoryId",
    "commitSha",
    "ruleId",
    "detectionStatus",
    "groundTruth",
    "classification",
    "remediationStage"
  ],
  "properties": {
    "observationId": {
      "type": "string",
      "pattern": "^OBS-\\d{4,}$",
      "description": "Unique observation ID"
    },
    "repositoryId": {
      "type": "string",
      "pattern": "^REAL-REPO-\\d{3,}$",
      "description": "Target repository identifier"
    },
    "commitSha": {
      "type": "string",
      "pattern": "^[0-9a-fA-F]{40}$",
      "description": "Commit SHA of the analyzed repository"
    },
    "ruleId": {
      "type": "string",
      "description": "Security rule evaluated, e.g., SEC-001-FAIL-OPEN, SEC-005-SQLI"
    },
    "detectionStatus": {
      "type": "string",
      "enum": ["DETECTED", "NOT_DETECTED"],
      "description": "Whether SentinelPR raised a finding for this construct"
    },
    "detectedSeverity": {
      "type": "string",
      "enum": ["CRITICAL", "HIGH", "MEDIUM", "LOW", "INFO", "NONE"],
      "description": "Reported severity if detected, or NONE"
    },
    "location": {
      "type": "object",
      "properties": {
        "filePath": { "type": "string" },
        "startLine": { "type": "integer", "minimum": 1 },
        "endLine": { "type": "integer", "minimum": 1 },
        "targetConstruct": { "type": "string" }
      },
      "additionalProperties": false
    },
    "findingSnippet": {
      "type": "string",
      "description": "Original code snippet flagged by SentinelPR"
    },
    "rawEngineFinding": {
      "type": "object",
      "description": "Full verbatim finding object generated by SentinelPR engine"
    },
    "groundTruth": {
      "type": "string",
      "enum": ["VULNERABLE", "SAFE", "UNKNOWN"],
      "description": "Independently verified real-world ground truth of the code"
    },
    "classification": {
      "type": "string",
      "enum": ["TP", "FP", "FN", "TN", "UNCERTAIN"],
      "description": "Empirical audit classification. If groundTruth is UNKNOWN, classification must be UNCERTAIN."
    },
    "classificationRationale": {
      "type": "string",
      "description": "Detailed justification with file paths, dataflow analysis, and framework context"
    },
    "reviewer": {
      "type": "string",
      "description": "Name or identifier of the engineer conducting the ground-truth audit"
    },
    "reviewedAt": {
      "type": "string",
      "format": "date-time",
      "description": "Timestamp when ground truth classification was finalized"
    },
    "remediationStage": {
      "type": "string",
      "enum": [
        "NOT_ATTEMPTED",
        "GENERATED",
        "APPLIED",
        "AST_VALID",
        "COMPILED",
        "TARGET_REMOVED",
        "REGRESSION_FREE",
        "FAILED"
      ],
      "description": "Highest verified stage achieved by automated remediation"
    },
    "remediationDetails": {
      "type": "object",
      "properties": {
        "generatedPatch": { "type": "string", "description": "Unified diff patch if generated" },
        "failureStage": { "type": "string", "description": "Stage where remediation failed if FAILED" },
        "failureReason": { "type": "string", "description": "Explanation of remediation failure" },
        "regressions": {
          "type": "array",
          "items": { "type": "string" },
          "description": "New warnings, syntax errors, or compiler breaks introduced"
        }
      },
      "additionalProperties": false
    },
    "engineDefect": {
      "type": "object",
      "properties": {
        "isEngineDefect": { "type": "boolean" },
        "component": {
          "type": "string",
          "enum": ["AST_PARSER", "TAINT_TRACKER", "RULE_PATTERN", "REASONING_ENGINE", "REMEDIATION_STRATEGY", "NONE"]
        },
        "description": { "type": "string" },
        "proposedFix": { "type": "string" }
      },
      "additionalProperties": false
    }
  },
  "additionalProperties": false
}
